{
  "$schema": "https://json-schema.org/draft/2020-12/schema",
  "$id": "https://mycel.local/schemas/topology.schema.json",
  "title": "Mycel Peer Simulator Topology",
  "description": "Language-neutral peer graph and bootstrap description for simulator runs.",
  "type": "object",
  "additionalProperties": false,
  "required": [
    "topology_id",
    "description",
    "fixture_set",
    "peers",
    "expected_outcomes"
  ],
  "properties": {
    "$schema": {
      "type": "string"
    },
    "topology_id": {
      "type": "string",
      "minLength": 1
    },
    "description": {
      "type": "string",
      "minLength": 1
    },
    "fixture_set": {
      "type": "string",
      "minLength": 1
    },
    "execution_mode": {
      "type": "string",
      "enum": [
        "single-process",
        "multi-process"
      ]
    },
    "peers": {
      "type": "array",
      "minItems": 1,
      "items": {
        "$ref": "#/$defs/peerRef"
      }
    },
    "expected_outcomes": {
      "type": "array",
      "minItems": 1,
      "items": {
        "type": "string",
        "minLength": 1
      },
      "uniqueItems": true
    },
    "notes": {
      "type": "array",
      "items": {
        "type": "string",
        "minLength": 1
      }
    },
    "metadata": {
      "type": "object"
    }
  },
  "$defs": {
    "peerRef": {
      "type": "object",
      "additionalProperties": false,
      "required": [
        "node_id",
        "role",
        "bootstrap_peers"
      ],
      "properties": {
        "node_id": {
          "type": "string",
          "minLength": 1
        },
        "role": {
          "type": "string",
          "minLength": 1
        },
        "bootstrap_peers": {
          "type": "array",
          "items": {
            "type": "string",
            "minLength": 1
          },
          "uniqueItems": true
        },
        "endpoint": {
          "type": "string",
          "minLength": 1
        },
        "capabilities": {
          "type": "array",
          "items": {
            "type": "string",
            "minLength": 1
          },
          "uniqueItems": true
        },
        "fixture_policy": {
          "type": "object"
        },
        "notes": {
          "type": "array",
          "items": {
            "type": "string",
            "minLength": 1
          }
        }
      }
    }
  }
}
