{
    "$schema": "./topology.schema.json",
    "topology_id": "session-unrequested-root-object-after-manifest",
    "description": "Seed emits a root OBJECT right after MANIFEST so the reader rejects the transcript as an unrequested object",
    "fixture_set": "fixtures/object-sets/session-unrequested-root-object-after-manifest",
    "execution_mode": "single-process",
    "peers": [
        {
            "node_id": "node:peer-seed",
            "role": "seed",
            "bootstrap_peers": [],
            "endpoint": "local:peer-seed"
        },
        {
            "node_id": "node:peer-reader-a",
            "role": "reader",
            "bootstrap_peers": [
                "node:peer-seed"
            ],
            "endpoint": "local:peer-reader-a"
        }
    ],
    "expected_outcomes": [
        "unrequested-root-object-after-manifest-rejected",
        "no-invalid-index-write"
    ],
    "notes": [
        "Session-level negative interop proof for a root OBJECT arriving before the reader sends WANT for it.",
        "The simulator injects the fault into an otherwise normal peer-store-generated transcript."
    ]
}
