{
    "$schema": "./topology.schema.json",
    "topology_id": "session-duplicate-hello",
    "description": "Seed emits a second HELLO so the reader rejects the transcript as a duplicate session-establishment violation",
    "fixture_set": "fixtures/object-sets/session-duplicate-hello",
    "execution_mode": "single-process",
    "peers": [
        {
            "node_id": "node:peer-seed",
            "role": "seed",
            "bootstrap_peers": [],
            "endpoint": "local:peer-seed"
        },
        {
            "node_id": "node:peer-reader-a",
            "role": "reader",
            "bootstrap_peers": [
                "node:peer-seed"
            ],
            "endpoint": "local:peer-reader-a"
        }
    ],
    "expected_outcomes": [
        "duplicate-hello-rejected",
        "no-invalid-index-write"
    ],
    "notes": [
        "Session-level negative interop proof for duplicate HELLO handling.",
        "The simulator injects the fault into an otherwise normal peer-store-generated transcript."
    ]
}
