{
    "$schema": "./topology.schema.json",
    "topology_id": "session-stale-object-want-after-heads-replace",
    "description": "Seed replaces advertised roots and then asks for an object that was only reachable from the withdrawn root set",
    "fixture_set": "fixtures/object-sets/session-stale-object-want-after-heads-replace",
    "execution_mode": "single-process",
    "peers": [
        {
            "node_id": "node:peer-seed",
            "role": "seed",
            "bootstrap_peers": [],
            "endpoint": "local:peer-seed"
        },
        {
            "node_id": "node:peer-reader-a",
            "role": "reader",
            "bootstrap_peers": [
                "node:peer-seed"
            ],
            "endpoint": "local:peer-reader-a"
        }
    ],
    "expected_outcomes": [
        "stale-object-want-after-heads-replace-rejected",
        "no-invalid-index-write"
    ],
    "notes": [
        "Session-level negative interop proof for replace=true HEADS withdrawing the old accepted sync roots.",
        "The simulator injects a stale WANT after the replacement HEADS to ensure the reader no longer accepts dependencies from the previous root set."
    ]
}
