{
  "$schema": "./topology.schema.json",
  "topology_id": "partial-doc-sync",
  "description": "Seed with two documents; one reader performs a selective sync requesting only the first document",
  "fixture_set": "fixtures/object-sets/partial-doc-sync",
  "execution_mode": "single-process",
  "peers": [
    {
      "node_id": "node:peer-seed",
      "role": "seed",
      "bootstrap_peers": [],
      "endpoint": "local:peer-seed"
    },
    {
      "node_id": "node:peer-reader-a",
      "role": "reader",
      "bootstrap_peers": [
        "node:peer-seed"
      ],
      "endpoint": "local:peer-reader-a"
    }
  ],
  "expected_outcomes": [
    "partial-doc-sync-success",
    "partial-store-stable",
    "partial-accepted-heads-correct"
  ],
  "notes": [
    "Use this topology to verify that a reader can selectively sync a subset of the seed's documents.",
    "The reader requests only doc:partial-alpha; doc:partial-beta must remain absent from the reader store."
  ]
}
