{
    "$schema": "./topology.schema.json",
    "topology_id": "session-unadvertised-revision-want-after-manifest",
    "description": "Seed emits WANT for an unadvertised revision after MANIFEST so the reader rejects the transcript as outside accepted sync roots",
    "fixture_set": "fixtures/object-sets/session-unadvertised-revision-want-after-manifest",
    "execution_mode": "single-process",
    "peers": [
        {
            "node_id": "node:peer-seed",
            "role": "seed",
            "bootstrap_peers": [],
            "endpoint": "local:peer-seed"
        },
        {
            "node_id": "node:peer-reader-a",
            "role": "reader",
            "bootstrap_peers": [
                "node:peer-seed"
            ],
            "endpoint": "local:peer-reader-a"
        }
    ],
    "expected_outcomes": [
        "unadvertised-revision-want-after-manifest-rejected",
        "no-invalid-index-write"
    ],
    "notes": [
        "Session-level negative interop proof for WANT requesting a revision outside MANIFEST-established accepted sync roots.",
        "The simulator injects the fault into an otherwise normal peer-store-generated transcript."
    ]
}
