{
    "$schema": "./topology.schema.json",
    "topology_id": "session-unadvertised-root-object-after-root-want",
    "description": "Seed advertises one root, receives a WANT for it, and then sends a different root revision OBJECT so the reader rejects the transcript as an advertised-root violation",
    "fixture_set": "fixtures/object-sets/session-unadvertised-root-object-after-root-want",
    "execution_mode": "single-process",
    "peers": [
        {
            "node_id": "node:peer-seed",
            "role": "seed",
            "bootstrap_peers": [],
            "endpoint": "local:peer-seed"
        },
        {
            "node_id": "node:peer-reader-a",
            "role": "reader",
            "bootstrap_peers": [
                "node:peer-seed"
            ],
            "endpoint": "local:peer-reader-a"
        }
    ],
    "expected_outcomes": [
        "unadvertised-root-object-after-root-want-rejected",
        "no-invalid-index-write"
    ],
    "notes": [
        "Session-level negative interop proof for a seed violating its own advertised root set on the OBJECT response path.",
        "The simulator injects the fault into an otherwise normal peer-store-generated transcript."
    ]
}
