{
    "$schema": "./topology.schema.json",
    "topology_id": "snapshot-sync-without-capability",
    "description": "Seed holds a snapshot but does not advertise snapshot-sync capability before emitting SNAPSHOT_OFFER",
    "fixture_set": "fixtures/object-sets/snapshot-sync-without-capability",
    "execution_mode": "single-process",
    "peers": [
        {
            "node_id": "node:peer-seed",
            "role": "seed",
            "bootstrap_peers": [],
            "endpoint": "local:peer-seed"
        },
        {
            "node_id": "node:peer-reader-a",
            "role": "reader",
            "bootstrap_peers": [
                "node:peer-seed"
            ],
            "endpoint": "local:peer-reader-a"
        }
    ],
    "expected_outcomes": [
        "snapshot-offer-capability-rejected",
        "no-invalid-index-write"
    ],
    "notes": [
        "Negative capability-gated interop proof for SNAPSHOT_OFFER.",
        "Use this topology to show that optional snapshot messages are rejected when the seed omitted snapshot-sync from its advertised capabilities."
    ]
}
