{
    "$schema": "./topology.schema.json",
    "topology_id": "session-missing-bye",
    "description": "Seed omits the final BYE so the reader completes sync with a warning-level session note",
    "fixture_set": "fixtures/object-sets/session-missing-bye",
    "execution_mode": "single-process",
    "peers": [
        {
            "node_id": "node:peer-seed",
            "role": "seed",
            "bootstrap_peers": [],
            "endpoint": "local:peer-seed"
        },
        {
            "node_id": "node:peer-reader-a",
            "role": "reader",
            "bootstrap_peers": [
                "node:peer-seed"
            ],
            "endpoint": "local:peer-reader-a"
        }
    ],
    "expected_outcomes": [
        "missing-bye-session-note"
    ],
    "notes": [
        "Warning-only session proof for a transcript that ends without BYE.",
        "The simulator injects the fault into an otherwise normal peer-store-generated transcript."
    ]
}
