{
    "$schema": "./topology.schema.json",
    "topology_id": "session-stale-dependency-object-after-heads-replace",
    "description": "Seed replaces advertised roots and then replays the withdrawn dependency OBJECT",
    "fixture_set": "fixtures/object-sets/session-stale-dependency-object-after-heads-replace",
    "execution_mode": "single-process",
    "peers": [
        {
            "node_id": "node:peer-seed",
            "role": "seed",
            "bootstrap_peers": [],
            "endpoint": "local:peer-seed"
        },
        {
            "node_id": "node:peer-reader-a",
            "role": "reader",
            "bootstrap_peers": [
                "node:peer-seed"
            ],
            "endpoint": "local:peer-reader-a"
        }
    ],
    "expected_outcomes": [
        "stale-dependency-object-after-heads-replace-rejected",
        "no-invalid-index-write"
    ],
    "notes": [
        "Session-level negative interop proof for replace=true HEADS clearing pending state for a withdrawn dependency OBJECT.",
        "The simulator injects replacement HEADS and then replays the stale patch OBJECT to confirm it is now unrequested."
    ]
}
