{
    "$schema": "./topology.schema.json",
    "topology_id": "session-snapshot-want-before-manifest",
    "description": "Seed emits SNAPSHOT_OFFER and then WANT before MANIFEST or HEADS so the reader rejects the transcript as missing head context",
    "fixture_set": "fixtures/object-sets/session-snapshot-want-before-manifest",
    "execution_mode": "single-process",
    "peers": [
        {
            "node_id": "node:peer-seed",
            "role": "seed",
            "bootstrap_peers": [],
            "endpoint": "local:peer-seed"
        },
        {
            "node_id": "node:peer-reader-a",
            "role": "reader",
            "bootstrap_peers": [
                "node:peer-seed"
            ],
            "endpoint": "local:peer-reader-a"
        }
    ],
    "expected_outcomes": [
        "snapshot-want-before-manifest-rejected",
        "no-invalid-index-write"
    ],
    "notes": [
        "Prior-head-context negative interop proof for snapshot-assisted sync.",
        "The simulator injects an offered snapshot and a premature WANT into an otherwise normal peer-store-generated transcript."
    ]
}
