{
    "$schema": "./topology.schema.json",
    "topology_id": "incremental-sync",
    "description": "Seed has genesis and follow-up revision; reader starts with genesis only and receives the follow-up via HEADS-based incremental sync",
    "fixture_set": "fixtures/object-sets/incremental-sync",
    "execution_mode": "single-process",
    "peers": [
        {
            "node_id": "node:peer-seed",
            "role": "seed",
            "bootstrap_peers": [],
            "endpoint": "local:peer-seed"
        },
        {
            "node_id": "node:peer-reader-a",
            "role": "reader",
            "bootstrap_peers": [
                "node:peer-seed"
            ],
            "endpoint": "local:peer-reader-a"
        }
    ],
    "expected_outcomes": [
        "incremental-sync-success",
        "new-objects-verified"
    ],
    "notes": [
        "Use this topology to verify that a reader with an already-complete base state can receive new revisions via incremental HEADS-based sync without a full MANIFEST exchange."
    ]
}
