{
    "$schema": "./topology.schema.json",
    "topology_id": "session-stale-root-want-after-heads-replace",
    "description": "Seed replaces advertised roots and then asks again for the withdrawn root revision",
    "fixture_set": "fixtures/object-sets/session-stale-root-want-after-heads-replace",
    "execution_mode": "single-process",
    "peers": [
        {
            "node_id": "node:peer-seed",
            "role": "seed",
            "bootstrap_peers": [],
            "endpoint": "local:peer-seed"
        },
        {
            "node_id": "node:peer-reader-a",
            "role": "reader",
            "bootstrap_peers": [
                "node:peer-seed"
            ],
            "endpoint": "local:peer-reader-a"
        }
    ],
    "expected_outcomes": [
        "stale-root-want-after-heads-replace-rejected",
        "no-invalid-index-write"
    ],
    "notes": [
        "Session-level negative interop proof for replace=true HEADS withdrawing the previously advertised root revision itself.",
        "The simulator injects a stale root-revision WANT after the replacement HEADS to confirm old roots are no longer valid WANT targets."
    ]
}
