{
  "$schema": "./topology.schema.json",
  "topology_id": "partial-want-recovery",
  "description": "One seed and one reader exercise deterministic WANT-based recovery",
  "fixture_set": "fixtures/object-sets/partial-want-recovery",
  "execution_mode": "single-process",
  "peers": [
    {
      "node_id": "node:peer-seed",
      "role": "seed",
      "bootstrap_peers": [],
      "endpoint": "local:peer-seed"
    },
    {
      "node_id": "node:peer-reader-a",
      "role": "reader",
      "bootstrap_peers": ["node:peer-seed"],
      "endpoint": "local:peer-reader-a"
    }
  ],
  "expected_outcomes": [
    "missing-objects-requested",
    "recovery-success",
    "post-recovery-replay-success"
  ],
  "notes": [
    "Use this topology to observe deterministic recovery after a missing-object WANT cycle."
  ]
}
